Bavarian Auto Haus|500 Autobahn Ln|212-555-2025
VIN: 10001, Year: 2019, Make: BMW, Model: X5, Type: SUV, Color: Black, Odometer: 45300, Price: 43995.0
VIN: 10002, Year: 2021, Make: BMW, Model: 3 Series, Type: Sedan, Color: White, Odometer: 22100, Price: 37950.0
VIN: 10003, Year: 2020, Make: BMW, Model: M4, Type: Coupe, Color: Blue, Odometer: 15700, Price: 58900.0
VIN: 10004, Year: 2018, Make: BMW, Model: X3, Type: SUV, Color: Gray, Odometer: 62300, Price: 31995.0
VIN: 10005, Year: 2022, Make: BMW, Model: i4, Type: Sedan, Color: Red, Odometer: 8600, Price: 51999.0
VIN: 10010, Year: 2023, Make: BMW, Model: M5, Type: Sedan, Color: Black, Odometer: 12034, Price: 109239.0
